{
  "schema_version": 1,
  "dataset_id": "android-context-routing-independent-v1",
  "authored_date": "2026-10-14",
  "evaluation_date": "2026-10-14",
  "methodology": "Human-authored task intents and expected context, independent of the router's rule configuration. Required/allowed/forbidden context is curated per task. It is not generated from routing/task-taxonomy.json.",
  "global_required_policies": [
    "security",
    "provenance",
    "scope_isolation",
    "source_access",
    "reporting",
    "testing_evidence",
    "freshness",
    "no_hallucinated_api"
  ],
  "tasks": [
    {
      "id": "mat-foundations",
      "domain_group": "material3_foundations",
      "task": "Review foundational Material 3 design principles for a new product.",
      "expected_domains": [
        "material3_foundations"
      ],
      "required_sources": [
        "material3_site"
      ],
      "allowed_optional_sources": [],
      "forbidden_sources": [
        "hilt_android",
        "macrobenchmark",
        "figma_m3_kit"
      ],
      "required_knowledge": [
        "knowledge/material3/foundations.md"
      ],
      "allowed_optional_knowledge": [
        "knowledge/material3/principles.md"
      ],
      "required_skills": [
        "material3-expressive"
      ],
      "allowed_optional_skills": [
        "visual-design-validation"
      ],
      "required_policies": [
        "design_compliance",
        "source_access"
      ],
      "required_freshness_sources": [
        "material3_site"
      ],
      "expected_routing_status": "routed_with_limitations",
      "required_evidence_actions": [
        "current linked Material.io page"
      ]
    },
    {
      "id": "mat-expressive",
      "domain_group": "material3_expressive",
      "task": "Plan a Material 3 Expressive design system.",
      "expected_domains": [
        "material3_expressive"
      ],
      "required_sources": [
        "material3_site",
        "androidx_material3_package"
      ],
      "allowed_optional_sources": [
        "androidx_material_theme",
        "google_android_skills"
      ],
      "forbidden_sources": [
        "hilt_android",
        "macrobenchmark",
        "figma_m3_kit"
      ],
      "required_knowledge": [
        "knowledge/material3/principles.md"
      ],
      "allowed_optional_knowledge": [
        "knowledge/material3/foundations.md",
        "knowledge/androidx/material3-api-compatibility.md"
      ],
      "required_skills": [
        "material3-expressive"
      ],
      "allowed_optional_skills": [
        "kotlin-compose",
        "visual-design-validation"
      ],
      "required_policies": [
        "design_compliance",
        "api_compatibility",
        "experimental_api"
      ],
      "required_freshness_sources": [
        "androidx_material3_package"
      ],
      "expected_routing_status": "routed_with_limitations",
      "required_evidence_actions": [
        "current linked Material.io page"
      ]
    },
    {
      "id": "mat-color",
      "domain_group": "material3_color",
      "task": "Define Material color roles, tonal palette and dynamic color in Compose.",
      "expected_domains": [
        "material3_color",
        "compose_ui"
      ],
      "required_sources": [
        "material3_site",
        "androidx_color_scheme",
        "androidx_material_theme"
      ],
      "allowed_optional_sources": [
        "google_android_skills",
        "androidx_material3_package"
      ],
      "forbidden_sources": [
        "hilt_android",
        "macrobenchmark",
        "figma_m3_kit"
      ],
      "required_knowledge": [
        "knowledge/material3/color-typography.md"
      ],
      "allowed_optional_knowledge": [
        "knowledge/material3/tokens-navigation.md",
        "knowledge/androidx/material3-api-compatibility.md"
      ],
      "required_skills": [
        "material3-expressive"
      ],
      "allowed_optional_skills": [
        "kotlin-compose",
        "visual-design-validation"
      ],
      "required_policies": [
        "design_compliance",
        "api_compatibility",
        "accessibility_review"
      ],
      "required_freshness_sources": [
        "androidx_color_scheme",
        "androidx_material_theme"
      ],
      "expected_routing_status": "routed_with_limitations",
      "required_evidence_actions": [
        "target project artifact"
      ]
    },
    {
      "id": "mat-typography",
      "domain_group": "material3_typography",
      "task": "Review Material typography scale and accessible text styles.",
      "expected_domains": [
        "material3_typography",
        "material3_accessibility"
      ],
      "required_sources": [
        "material3_site",
        "androidx_typography",
        "androidx_material_theme",
        "androidx_compose_accessibility"
      ],
      "allowed_optional_sources": [
        "androidx_material3_package"
      ],
      "forbidden_sources": [
        "hilt_android",
        "macrobenchmark",
        "figma_m3_kit"
      ],
      "required_knowledge": [
        "knowledge/material3/color-typography.md",
        "knowledge/material3/accessibility-interaction.md"
      ],
      "allowed_optional_knowledge": [
        "knowledge/androidx/compose-accessibility.md",
        "knowledge/androidx/material3-api-compatibility.md"
      ],
      "required_skills": [
        "material3-expressive"
      ],
      "allowed_optional_skills": [
        "kotlin-compose",
        "visual-design-validation",
        "android-testing"
      ],
      "required_policies": [
        "design_compliance",
        "accessibility_review",
        "api_compatibility"
      ],
      "required_freshness_sources": [
        "androidx_typography",
        "androidx_material_theme"
      ],
      "expected_routing_status": "routed_with_limitations",
      "required_evidence_actions": [
        "target project artifact"
      ]
    },
    {
      "id": "mat-components",
      "domain_group": "material3_components",
      "task": "Specify Material button and card component anatomy and component guidelines.",
      "expected_domains": [
        "material3_components"
      ],
      "required_sources": [
        "material3_site",
        "androidx_material3_package"
      ],
      "allowed_optional_sources": [
        "google_android_skills",
        "androidx_material_theme"
      ],
      "forbidden_sources": [
        "hilt_android",
        "macrobenchmark",
        "figma_m3_kit"
      ],
      "required_knowledge": [
        "knowledge/material3/components-states.md"
      ],
      "allowed_optional_knowledge": [
        "knowledge/material3/principles.md",
        "knowledge/androidx/material3-api-compatibility.md"
      ],
      "required_skills": [
        "material3-expressive"
      ],
      "allowed_optional_skills": [
        "kotlin-compose",
        "visual-design-validation"
      ],
      "required_policies": [
        "design_compliance",
        "api_compatibility",
        "accessibility_review"
      ],
      "required_freshness_sources": [
        "androidx_material3_package"
      ],
      "expected_routing_status": "routed_with_limitations",
      "required_evidence_actions": [
        "target project artifact"
      ]
    },
    {
      "id": "mat-component-states",
      "domain_group": "material3_component_states",
      "task": "Review selected, disabled and pressed Material component states.",
      "expected_domains": [
        "material3_component_states",
        "material3_components"
      ],
      "required_sources": [
        "material3_site",
        "androidx_material3_package",
        "androidx_compose_accessibility"
      ],
      "allowed_optional_sources": [],
      "forbidden_sources": [
        "hilt_android",
        "macrobenchmark",
        "figma_m3_kit"
      ],
      "required_knowledge": [
        "knowledge/material3/components-states.md",
        "knowledge/material3/accessibility-interaction.md"
      ],
      "allowed_optional_knowledge": [],
      "required_skills": [
        "material3-expressive",
        "android-testing"
      ],
      "allowed_optional_skills": [
        "kotlin-compose"
      ],
      "required_policies": [
        "design_compliance",
        "accessibility_review",
        "testing_evidence"
      ],
      "required_freshness_sources": [
        "androidx_material3_package"
      ],
      "expected_routing_status": "routed_with_limitations",
      "required_evidence_actions": [
        "selected, pressed, disabled"
      ]
    },
    {
      "id": "mat-shape",
      "domain_group": "material_shapes",
      "task": "Use MaterialShapes to morph component shapes in Compose.",
      "expected_domains": [
        "compose_ui",
        "material3_components",
        "material_shapes"
      ],
      "required_sources": [
        "material_shape_principles",
        "material_shapes_api"
      ],
      "allowed_optional_sources": [
        "androidx_material3_package",
        "material3_site",
        "google_android_skills"
      ],
      "forbidden_sources": [
        "hilt_android",
        "macrobenchmark",
        "figma_m3_kit"
      ],
      "required_knowledge": [
        "knowledge/material3/shapes.md",
        "knowledge/androidx/material3-api-compatibility.md"
      ],
      "allowed_optional_knowledge": [
        "knowledge/material3/principles.md"
      ],
      "required_skills": [
        "material3-expressive"
      ],
      "allowed_optional_skills": [
        "kotlin-compose",
        "visual-design-validation"
      ],
      "required_policies": [
        "design_compliance",
        "api_compatibility",
        "experimental_api"
      ],
      "required_freshness_sources": [
        "material_shapes_api"
      ],
      "expected_routing_status": "routed_with_limitations",
      "required_evidence_actions": [
        "opt-in annotation"
      ]
    },
    {
      "id": "mat-motion",
      "domain_group": "material_motion",